{
    "$schema": "https://json-schema.org/draft-07/schema",
    "$id": "service.compiler.extension.schema.json",
    "type": "object",
    "properties": {
        "class": {
            "$ref": "definitions.json#definitions/classDeclaration"
        },
        "sortOrder": {
            "type": "integer",
            "minimum": 0
        },
        "key": {
            "$ref": "definitions.json#definitions/identifierDeclaration"
        },
        "parameters": {
            "type": "object"
        },
        "schema": {
            "$schema": "https://json-schema.org/draft-07/schema"
        }
    },
    "required": ["class", "sortOrder", "key"]
}